{
  "schemaVersion": 1,
  "projectName": "@appsforgood/next-supabase-kit",
  "productSummary": "A public npm pack (@appsforgood/next-supabase-kit, current latest 0.4.9) that installs six agents, twelve default skills, and a user guide into Next.js + Supabase projects. Default init writes AGENTS.md, USER_GUIDE.md, USER_GUIDE.html, and native IDE files. After init, the current chat launches Planner then the named owner. Optional session, Studio, research, and orchestrate stay off default init.",
  "productCategory": "tool",
  "primaryAudience": "Engineers and AI coding agents working on Next.js + Supabase projects who want structured agent roles, quality gates, and living documentation installed into their repos.",
  "primaryWorkflows": [
    "Install the kit into a downstream project with agent-kit init --activate all, then say the change so the session launches specialists",
    "Upgrade an installed project with agent-kit diff and agent-kit update while preserving local docs through conflict files",
    "QA user-visible work with browser-qa desktop and mobile screenshots; ship with a named kill switch"
  ],
  "businessCriticalBehavior": [
    "init and update must never silently overwrite user-customized docs; divergent files become .agent-kit/conflicts entries",
    "audit --json output shape and readiness levels are a public contract used by CI gates",
    "npm publishing must go through Trusted Publishing/OIDC with SBOM and post-publish verification"
  ],
  "architecture": {
    "packageManager": "npm",
    "scripts": [
      "build",
      "dev",
      "examples:check",
      "lint",
      "pack:check",
      "publish:verify",
      "release:check",
      "sbom:check",
      "sbom:generate",
      "smoke",
      "smoke:audit-gate",
      "smoke:install",
      "smoke:studio",
      "test",
      "test:watch",
      "typecheck",
      "version:check"
    ],
    "frameworks": [],
    "uiLibraries": [],
    "hasSupabase": true,
    "supabaseSignals": [
      ".agent-kit\\agents\\supabase-postgres-engineer.md",
      ".agent-kit\\assistant-adapters\\github-next-supabase.instructions.md",
      ".agent-kit\\profiles\\stack-remix-supabase.md",
      ".agent-kit\\rosters\\next-supabase-default-council.json",
      ".agent-kit\\skills\\supabase-auth-rls.md",
      "agents\\supabase-postgres-engineer.md",
      "assistant-adapters\\github-next-supabase.instructions.md",
      "examples\\next-supabase-installed\\.agent-kit\\agent-roster.json",
      "examples\\next-supabase-installed\\.agent-kit\\manifest.json",
      "examples\\next-supabase-installed\\.agent-kit\\model-routing.json",
      "examples\\next-supabase-installed\\.agent-kit\\overrides.json",
      "examples\\next-supabase-installed\\README.md",
      "examples\\next-supabase-installed\\audit-output.json",
      "examples\\next-supabase-installed\\tree.txt",
      "profiles\\stack-remix-supabase.md",
      "research\\findings\\ShenSeanChen__launch-mvp-stripe-nextjs-supabase.md",
      "research\\findings\\imbhargav5__nextbase-nextjs-supabase-starter.md",
      "research\\findings\\supabase-community__nextjs-openai-doc-search.md",
      "research\\findings\\supabase__auth-helpers.md",
      "research\\findings\\supabase__supabase.md"
    ],
    "testTools": [
      "vitest"
    ],
    "envExampleKeys": [
      "GITHUB_TOKEN"
    ],
    "deployment": []
  },
  "dataSensitivity": [
    "No user data is stored; the CLI reads and writes local project files only",
    "GITHUB_TOKEN (optional, research subsystem only) must never be committed or written into generated files"
  ],
  "authModel": "None at runtime. The CLI is local-first and requires no accounts. Release authentication uses npm Trusted Publishing (OIDC) from GitHub Actions; the optional research commands use a GITHUB_TOKEN env var.",
  "tenantModel": "Single local repository per install. This is a developer tool, not a hosted multi-tenant product.",
  "integrations": [
    "npm registry (publishing via Trusted Publishing/OIDC)",
    "GitHub Actions (CI, release, CodeQL, Scorecard, Dependabot, dependency review)",
    "GitHub API via @octokit/rest (research discover/scan only, optional)"
  ],
  "uiDirection": {
    "preferred": "Terminal-first UX: human-readable summaries by default, stable --json output for machines, actionable error messages with documented exit codes.",
    "avoid": "Raw JSON dumps as the default human output, interactive prompts that break CI, and stack traces as user-facing errors."
  },
  "messaging": {
    "valueProposition": "Install a complete, auditable agent operating system (roles, skills, quality gates, docs, and model routing) into a Next.js + Supabase repo with one command, and keep it upgradeable without losing local customizations.",
    "proof": [
      "Conflict-safe init/update behavior covered by vitest suites and smoke-install regression fixture",
      "Machine-readable audit with readiness gate used by this repo's own CI (smoke:audit-gate)",
      "Supply-chain hardening: Trusted Publishing, SBOM attestation, CodeQL, Scorecard, Dependabot"
    ],
    "objections": [
      "Default init does not restore the 0.3 council OS, Studio, or orchestrate",
      "Only the next-supabase stack is the default pack; other profiles stay optional",
      "Playbooks are advisory to the model until skip-intake from external dogfood lands"
    ]
  },
  "qualityTarget": "best-practice-candidate",
  "knownConstraints": [
    "Node >= 20, ESM-only, four runtime dependencies (commander, zod, @octokit/rest, simple-git)",
    "Local-first Agent Studio: no database, daemon, or model API keys required",
    "Windows, macOS, and Linux must all work; path handling must stay cross-platform"
  ],
  "openQuestions": [
    "Which skipped skills will external Next.js + Supabase dogfood promote into Excuse → Reality Reject lines?",
    "When should Changesets CLI v3 and changesets/action v2 be adopted together?"
  ],
  "evidence": [
    {
      "source": "agent-kit context scan",
      "note": "Scanned 472 files for package, Supabase, test, env example, and deployment signals."
    }
  ],
  "lastReviewedAt": "2026-09-18T01:00:00.000Z",
  "owners": ["lukey662"]
}
